{"schema":"oreflow.readiness/v1","product_version":"0.10.002","catalog_sha256":"e6f5081d1f1ce15a5831e41dcf0f97521b9a40241acc094f4dcf8bbb1c0d45f1","contracts":[{"id":"oreflow-benchmark-v2","version":"1.0.1","status":"real","state":"available","provenance":"real","missing":[]},{"id":"oreflow-case-v2","version":"1.0.1","status":"real","state":"available","provenance":"real","missing":[]},{"id":"oreflow-contract-probes-v1","version":"1.0.1","status":"real","state":"available","provenance":"real","missing":[]},{"id":"oreflow-contract-v1","version":"1.0.1","status":"real","state":"available","provenance":"real","missing":[]},{"id":"oreflow-geomet-lct-v1","version":"1.0.1","status":"real","state":"available","provenance":"real","missing":[]},{"id":"oreflow-hzdr-summary-v1","version":"1.0.1","status":"real","state":"available","provenance":"real","missing":[]},{"id":"oreflow-index-v2","version":"1.0.1","status":"real","state":"available","provenance":"real","missing":[]},{"id":"oreflow-iron-plant-soft-sens","version":"1.0.1","status":"real","state":"available","provenance":"real","missing":[]},{"id":"oreflow-learning-v1","version":"1.0.1","status":"real","state":"available","provenance":"real","missing":[]},{"id":"oreflow-manifest-v2","version":"1.0.1","status":"real","state":"available","provenance":"real","missing":[]},{"id":"oreflow-particle-benchmark-v","version":"1.0.1","status":"real","state":"available","provenance":"real","missing":[]},{"id":"oreflow-process-surrogate-v1","version":"1.0.1","status":"real","state":"available","provenance":"real","missing":[]},{"id":"oreflow-real-samples-v1","version":"1.0.1","status":"real","state":"available","provenance":"real","missing":[]},{"id":"oreflow-screen-v1","version":"1.0.1","status":"real","state":"available","provenance":"real","missing":[]},{"id":"oreflow-studies-v1","version":"1.0.1","status":"real","state":"available","provenance":"real","missing":[]},{"id":"oreflow-validation-v2","version":"1.0.1","status":"real","state":"available","provenance":"real","missing":[]},{"id":"readiness","version":"1.0.1","status":"real","state":"available","provenance":"real","missing":[]}]}